team,tournament,match,alliance,sandstorm_start_hatch,sandstorm_start_cargo,sandstorm_start_lvl_1,sandstorm_start_lvl_2,sandstorm_hab,sandstorm_rocket_cargo_1,sandstorm_rocket_cargo_2,sandstorm_rocket_cargo_3,sandstorm_total_rocket_cargo,sandstorm_rocket_hatch_1,sandstorm_rocket_hatch_2,sandstorm_rocket_hatch_3,sandstorm_total_rocket_hatch,sandstorm_cargoship_cargo,sandstorm_cargoship_hatch,teleop_rocket_cargo_1,teleop_rocket_cargo_2,teleop_rocket_cargo_3,teleop_total_rocket_cargo,teleop_rocket_hatch_1,teleop_rocket_hatch_2,teleop_rocket_hatch_3,teleop_total_rocket_hatch,teleop_cargoship_cargo,teleop_cargoship_hatch,teleop_climb_1,teleop_climb_2,teleop_climb_3,rating_cargo_accuracy,rating_hatch_accuracy,rating_speed,rating_defense,rating_stability,disabled,interfere,defense,comment_scout,comment_super,match_id,scout_id,Total Game Pieces,Hab Climb
6398,CAVE,19,r,FALSE,TRUE,FALSE,TRUE,TRUE,0,0,0,0,0,0,0,0,0,0,0,0,0,0,1,0,0,1,2,0,TRUE,FALSE,FALSE,3,3,3,1,3,FALSE,FALSE,FALSE,Their cargo outtake takes a long time to work,,19@CAVE:r[6934;3512;6398],2,3,3
6934,CAVE,19,r,FALSE,FALSE,TRUE,FALSE,FALSE,0,0,0,0,0,0,0,0,0,0,0,0,0,0,0,0,0,0,0,0,TRUE,FALSE,FALSE,1,2,3,2,2,FALSE,FALSE,TRUE,Not good or effective. They stayed on their side of line trying to defend from defenders and in the last fifty seconds briefly tried to pin opposing robot but was unsuccessful. Ten seconds later they returned and climbed to level one with over thirty seconds remaining.,,19@CAVE:r[6934;3512;6398],0,0,3
3328,CAVE,20,b,TRUE,FALSE,TRUE,FALSE,TRUE,0,0,0,0,0,0,0,0,0,0,0,0,0,0,0,0,0,0,2,0,TRUE,FALSE,FALSE,3,1,3,1,3,FALSE,FALSE,FALSE,Dropped hatch panel during sandstorm; cycle time very slow,,20@CAVE:b[4711;3328;7650],1,2,3
4711,CAVE,20,b,FALSE,TRUE,FALSE,TRUE,FALSE,0,0,0,0,0,0,0,0,0,0,0,0,0,0,0,0,0,0,0,0,TRUE,FALSE,FALSE,1,1,2,2,2,FALSE,FALSE,TRUE,about to tip; pretty bad defense(not in the way),,20@CAVE:b[4711;3328;7650],0,0,3
7650,CAVE,20,b,TRUE,FALSE,TRUE,FALSE,TRUE,0,0,0,0,0,0,0,0,0,1,0,0,0,0,1,0,0,1,2,0,TRUE,FALSE,FALSE,3,5,3,1,5,FALSE,FALSE,FALSE,The climb was not successful; it was supposed to go to level 2.,,20@CAVE:b[4711;3328;7650],2,3,3
2486,CAVE,20,r,FALSE,TRUE,FALSE,TRUE,TRUE,0,0,0,0,0,0,0,0,1,0,0,0,0,0,0,0,0,0,2,1,TRUE,FALSE,FALSE,4,3,3,1,4,FALSE,FALSE,FALSE,Failed lv3 climb twice 7411 defended against them and 2486 was almost defenseless,,20@CAVE:r[3473;2486;6764],1,3,3
3473,CAVE,20,r,TRUE,FALSE,FALSE,TRUE,FALSE,0,0,0,0,0,0,0,0,0,0,0,0,0,0,0,0,0,0,3,1,FALSE,FALSE,FALSE,3,2,4,1,3,FALSE,FALSE,FALSE,Fast cycle time but inconsistent placement,,20@CAVE:r[3473;2486;6764],0,4,0
6764,CAVE,20,r,TRUE,FALSE,TRUE,FALSE,TRUE,0,0,0,0,0,0,0,0,0,0,0,0,0,0,0,0,0,0,0,0,FALSE,FALSE,FALSE,1,1,1,1,1,FALSE,FALSE,FALSE,Didn't do anything throughout the match... I think there was a connectivity issue but I'm not sure... It was not disabled,,20@CAVE:r[3473;2486;6764],2,0,0
3863,CAVE,21,b,TRUE,FALSE,TRUE,FALSE,TRUE,0,0,0,0,1,0,0,1,0,0,2,2,0,4,1,2,2,5,0,0,FALSE,FALSE,FALSE,4,4,4,1,4,FALSE,FALSE,FALSE,Fast cycle time; Consistent with hatch panel and cargo placement,,21@CAVE:b[7326;3863;5869],1,9,0
5869,CAVE,21,b,FALSE,FALSE,TRUE,FALSE,TRUE,0,0,0,0,0,0,0,0,0,0,0,0,0,0,0,0,0,0,0,0,TRUE,FALSE,FALSE,1,1,4,1,4,FALSE,FALSE,FALSE,Very inefficient cargo intake; was barely able to hold the cargo; and could not score anything.,,21@CAVE:b[7326;3863;5869],2,0,3
7326,CAVE,21,b,FALSE,FALSE,TRUE,FALSE,FALSE,0,0,0,0,0,0,0,0,0,0,0,0,0,0,0,0,0,0,0,0,FALSE,FALSE,FALSE,1,1,2,1,1,FALSE,FALSE,FALSE,nearly tipped over; stood around,,21@CAVE:b[7326;3863;5869],0,0,0
3925,CAVE,21,r,TRUE,FALSE,TRUE,FALSE,FALSE,0,0,0,0,0,0,0,0,0,0,2,0,0,2,2,0,0,2,1,1,TRUE,FALSE,FALSE,4,4,3,3,3,FALSE,FALSE,TRUE,Played defense once; almost knocked another robot over cycle times are pretty slow,,21@CAVE:r[4486;3925;4414],1,6,3
4414,CAVE,21,r,TRUE,FALSE,FALSE,TRUE,TRUE,0,0,0,0,1,0,1,2,0,0,1,2,2,5,1,2,1,4,0,0,FALSE,FALSE,TRUE,4,5,4,1,4,FALSE,FALSE,FALSE,,,21@CAVE:r[4486;3925;4414],2,9,12
4486,CAVE,21,r,FALSE,TRUE,TRUE,FALSE,TRUE,0,0,0,0,0,0,0,0,0,0,1,0,0,1,0,0,0,0,4,1,FALSE,TRUE,FALSE,3,4,4,1,3,FALSE,FALSE,FALSE,First three cargo attempts; including one in sandstorm; were unsuccessful but rest were good,,21@CAVE:r[4486;3925;4414],0,6,6
115,CAVE,22,b,TRUE,FALSE,FALSE,TRUE,TRUE,0,0,0,0,0,0,0,0,0,0,1,0,0,1,2,0,0,2,2,1,FALSE,TRUE,FALSE,4,3,4,1,3,FALSE,FALSE,FALSE,was blocked by defense a little; hatch was placed not perfectly so cargo and hatch fell out,,22@CAVE:b[115;3512;5107],0,6,6
3512,CAVE,22,b,FALSE,TRUE,FALSE,TRUE,FALSE,0,0,0,0,1,0,0,1,0,0,0,0,0,0,0,0,0,0,0,0,TRUE,FALSE,FALSE,1,3,2,3,3,FALSE,FALSE,TRUE,Does good pinning; buy may have gotten a penalty when trying to. May have been too aggressive at some points.,,22@CAVE:b[115;3512;5107],1,0,3
5107,CAVE,22,b,TRUE,FALSE,TRUE,FALSE,TRUE,0,0,0,0,0,0,0,0,0,0,0,0,0,0,2,2,0,4,0,0,TRUE,FALSE,FALSE,1,3,3,1,4,FALSE,FALSE,FALSE,The hatch was very wobbly while on the robot; making it difficult to place the hatch.,,22@CAVE:b[115;3512;5107],2,4,3
599,CAVE,22,r,TRUE,FALSE,FALSE,TRUE,TRUE,0,0,0,0,0,0,0,0,0,0,0,0,0,0,0,0,0,0,3,1,FALSE,TRUE,FALSE,4,2,2,1,3,FALSE,FALSE,FALSE,Their offense was pretty slow,,22@CAVE:r[7323;7887;599],2,4,6
7323,CAVE,22,r,TRUE,FALSE,TRUE,FALSE,FALSE,0,0,0,0,0,0,0,0,0,0,0,0,0,0,0,0,0,0,0,0,FALSE,FALSE,FALSE,1,1,1,1,1,TRUE,FALSE,FALSE,,,22@CAVE:r[7323;7887;599],0,0,0
7887,CAVE,22,r,FALSE,FALSE,FALSE,TRUE,FALSE,0,0,0,0,0,0,0,0,0,0,0,0,0,0,0,0,0,0,0,0,TRUE,FALSE,FALSE,1,1,3,2,3,FALSE,FALSE,TRUE,Kind of got pushed around by 3612 wandered around during teleop; wasn't very good at pinning,,22@CAVE:r[7323;7887;599],1,0,3
2486,CAVE,24,b,FALSE,TRUE,FALSE,TRUE,TRUE,0,0,0,0,0,0,0,0,0,0,0,0,0,0,0,0,0,0,3,0,TRUE,FALSE,FALSE,4,1,3,1,3,FALSE,FALSE,FALSE,slow at cargo; didn't do much else,,24@CAVE:b[4470;2486;5869],1,3,3
4470,CAVE,24,b,FALSE,FALSE,FALSE,TRUE,TRUE,0,0,0,0,0,0,0,0,0,0,0,0,0,0,0,0,0,0,1,2,TRUE,FALSE,FALSE,4,4,3,1,4,FALSE,FALSE,FALSE,had difficulty picking up hatches,,24@CAVE:b[4470;2486;5869],0,3,3
5869,CAVE,24,b,FALSE,FALSE,TRUE,FALSE,TRUE,0,0,0,0,0,0,0,0,0,0,0,0,0,0,0,0,0,0,0,0,FALSE,FALSE,FALSE,1,1,3,1,2,TRUE,TRUE,FALSE,Got disabled in the first half of the match right next to the human player station,,24@CAVE:b[4470;2486;5869],2,0,0
4201,CAVE,24,r,FALSE,FALSE,TRUE,FALSE,TRUE,0,0,0,0,0,0,0,0,0,0,0,0,0,0,0,0,0,0,5,0,FALSE,FALSE,FALSE,4,1,2,1,2,TRUE,FALSE,FALSE,Robot is not consistent; and also the robot doesn't look very strong,,24@CAVE:r[5857;6934;4201],2,5,0
6934,CAVE,24,r,FALSE,TRUE,TRUE,FALSE,FALSE,0,0,0,0,0,0,0,0,0,0,0,0,0,0,0,0,0,0,0,0,TRUE,FALSE,FALSE,2,1,4,3,4,FALSE,FALSE,TRUE,Had cargo then tried to play defense but didn't really have an effect,,24@CAVE:r[6934;3303;6553],0,0,3
3925,CAVE,25,b,FALSE,TRUE,TRUE,FALSE,TRUE,0,0,0,0,0,0,0,0,0,0,1,0,0,1,0,0,0,0,3,1,TRUE,FALSE,FALSE,5,2,4,1,4,FALSE,FALSE,FALSE,,,25@CAVE:b[6560;3925;4711],1,5,3
4711,CAVE,25,b,FALSE,TRUE,FALSE,TRUE,TRUE,0,0,0,0,0,0,0,0,0,0,0,0,0,0,0,0,0,0,1,0,TRUE,FALSE,FALSE,2,1,2,2,3,FALSE,FALSE,TRUE,Not aggressive on the defense,,25@CAVE:b[6560;3925;4711],2,1,3
6560,CAVE,25,b,TRUE,FALSE,TRUE,FALSE,FALSE,0,0,0,0,0,0,0,0,0,0,0,0,0,0,0,0,0,0,3,1,FALSE,FALSE,TRUE,4,3,3,1,4,FALSE,FALSE,FALSE,was slow throughout,,25@CAVE:b[6560;3925;4711],0,4,12
3303,CAVE,25,r,TRUE,FALSE,TRUE,FALSE,TRUE,0,0,0,0,0,0,0,0,0,0,0,0,0,0,0,0,0,0,0,0,FALSE,TRUE,FALSE,2,2,2,1,4,FALSE,FALSE,FALSE,Outtake was very unreliable and did not work throughout the game,,25@CAVE:r[4486;3303;6553],1,0,6
4486,CAVE,25,r,FALSE,TRUE,TRUE,FALSE,FALSE,0,0,0,0,1,0,0,1,0,0,1,0,0,1,0,0,0,0,2,0,TRUE,FALSE,FALSE,3,5,3,3,5,FALSE,FALSE,FALSE,they were not able to do the climb,,25@CAVE:r[4486;3303;6553],0,3,3
6553,CAVE,25,r,FALSE,TRUE,FALSE,TRUE,FALSE,0,0,0,0,0,0,0,0,0,0,0,0,0,0,0,0,0,0,3,0,FALSE,FALSE,FALSE,4,1,3,1,3,FALSE,FALSE,FALSE,The robot lost its balance a few times but did not fall. Moved back and forth many times before deciding where to go,,25@CAVE:r[4486;3303;6553],2,3,0
1138,CAVE,26,b,TRUE,FALSE,FALSE,TRUE,TRUE,0,0,0,0,0,0,0,0,0,0,0,0,0,0,0,0,0,0,3,0,FALSE,FALSE,TRUE,4,4,4,1,4,FALSE,TRUE,FALSE,,,26@CAVE:b[1138;5818;3473],0,3,12
3473,CAVE,26,b,TRUE,FALSE,TRUE,FALSE,TRUE,0,0,0,0,0,0,0,0,0,0,0,0,0,0,2,0,0,2,1,1,TRUE,FALSE,FALSE,4,3,3,1,4,FALSE,FALSE,FALSE,,,26@CAVE:b[1138;5818;3473],2,4,3
5818,CAVE,26,b,TRUE,FALSE,FALSE,TRUE,TRUE,0,0,0,0,0,0,0,0,0,0,0,0,0,0,1,0,0,1,0,4,TRUE,FALSE,FALSE,1,5,3,1,4,FALSE,FALSE,FALSE,,,26@CAVE:b[1138;5818;3473],1,5,3
294,CAVE,26,r,TRUE,FALSE,FALSE,TRUE,FALSE,0,0,0,0,0,0,0,0,0,0,0,0,0,0,1,0,0,1,0,0,FALSE,FALSE,TRUE,2,2,4,4,3,FALSE,FALSE,TRUE,Pinned a robot twice and played aggressive defense. Good stuck on a cargo ball in the middle,,26@CAVE:r[5136;294;6764],1,1,12
5136,CAVE,26,r,TRUE,FALSE,FALSE,TRUE,FALSE,0,0,0,0,0,0,0,0,0,1,0,0,1,1,0,0,1,1,0,0,TRUE,FALSE,FALSE,2,3,3,1,4,FALSE,FALSE,FALSE,Not very accurate hatch or cargo placement,,26@CAVE:r[5136;294;6764],0,2,3
6764,CAVE,26,r,FALSE,FALSE,TRUE,FALSE,FALSE,0,0,0,0,0,0,0,0,0,0,0,0,0,0,0,0,0,0,0,0,TRUE,FALSE,FALSE,1,1,2,1,2,FALSE,FALSE,FALSE,G9 foul; entered opp side even tho another defending not was there,,26@CAVE:r[5136;294;6764],2,0,3
114,CAVE,27,b,FALSE,FALSE,TRUE,FALSE,TRUE,0,0,0,0,1,0,0,1,0,0,2,2,0,4,1,2,2,5,0,0,TRUE,FALSE,FALSE,5,5,4,1,4,FALSE,FALSE,FALSE,very fast; very controlled; very accurate. saucy,,27@CAVE:b[114;6398;3328],0,9,3
3328,CAVE,27,b,TRUE,FALSE,TRUE,FALSE,TRUE,0,0,0,0,0,0,0,0,0,0,0,0,0,0,0,0,0,0,2,0,FALSE,FALSE,FALSE,2,1,2,1,4,TRUE,FALSE,FALSE,Disabled at the end of the match. Cargo placement had really bad accuracy,,27@CAVE:b[114;6398;3328],2,2,0
6398,CAVE,27,b,TRUE,FALSE,FALSE,TRUE,FALSE,0,0,0,0,0,0,0,0,0,0,0,0,0,0,0,0,0,0,0,0,TRUE,FALSE,FALSE,1,1,4,3,4,FALSE,FALSE,FALSE,lightweight bot; tried to defend but could not push opponent bots. would have been effective if heavier. returned to hab at 25 seconds,,27@CAVE:b[114;6398;3328],1,0,3
2543,CAVE,27,r,TRUE,FALSE,FALSE,TRUE,TRUE,0,0,0,0,0,0,0,0,0,1,0,0,0,0,0,0,0,0,5,0,TRUE,FALSE,FALSE,4,3,3,1,4,FALSE,FALSE,FALSE,Had a hard time to take in hatches at loading station,,27@CAVE:r[7324;2543;4414],1,5,3
4414,CAVE,27,r,TRUE,FALSE,FALSE,TRUE,TRUE,0,0,0,0,0,0,0,0,0,0,0,0,0,0,1,1,1,3,1,0,FALSE,FALSE,TRUE,4,4,3,1,4,FALSE,FALSE,FALSE,Was defended heavily but escaped. Was shaky at placing third level hatch,,27@CAVE:r[7324;2543;4414],2,4,12
7324,CAVE,27,r,FALSE,FALSE,TRUE,FALSE,FALSE,0,0,0,0,0,0,0,0,0,0,0,0,0,0,0,0,0,0,0,0,FALSE,FALSE,FALSE,1,1,2,2,3,TRUE,FALSE,FALSE,Lost piece of bumper on field. ; unsure movements. Unsuccessful defense against defense,,27@CAVE:r[7324;2543;4414],0,0,0
5510,CAVE,28,b,TRUE,FALSE,FALSE,TRUE,TRUE,0,0,0,0,2,0,0,2,0,0,0,0,0,0,2,0,0,2,0,1,TRUE,FALSE,FALSE,1,3,3,1,3,FALSE,FALSE,FALSE,Has a ramp,,28@CAVE:b[580;7326;5510],2,3,3
580,CAVE,28,b,TRUE,FALSE,FALSE,TRUE,FALSE,0,0,0,0,0,0,0,0,0,0,0,0,0,0,0,0,0,0,0,0,FALSE,FALSE,FALSE,1,3,1,1,3,TRUE,TRUE,FALSE,i seemed to be uncertain of what it was doing.,,28@CAVE:b[580;7326;5510],0,0,0
7326,CAVE,28,b,FALSE,FALSE,TRUE,FALSE,FALSE,0,0,0,0,0,0,0,0,0,0,0,0,0,0,0,0,0,0,0,0,TRUE,FALSE,FALSE,1,1,2,2,2,FALSE,FALSE,TRUE,super unstable; had no intake or outake. defended but did nothing,,28@CAVE:b[580;7326;5510],1,0,3
3863,CAVE,28,r,TRUE,FALSE,TRUE,FALSE,TRUE,0,0,0,0,1,0,0,1,0,0,0,2,0,2,1,2,1,4,0,0,TRUE,FALSE,FALSE,4,4,4,1,4,FALSE,TRUE,FALSE,They had some trouble with hatch intake at loading station,,28@CAVE:r[5700;3863;5477],1,6,3
5477,CAVE,28,r,FALSE,TRUE,FALSE,TRUE,TRUE,0,0,0,0,0,0,0,0,0,0,0,0,0,0,0,0,0,0,3,0,TRUE,FALSE,FALSE,4,1,3,1,4,FALSE,FALSE,FALSE,,,28@CAVE:r[5700;3863;5477],2,3,3
5700,CAVE,28,r,TRUE,FALSE,FALSE,TRUE,TRUE,0,0,0,0,0,0,0,0,0,0,1,0,0,1,0,0,0,0,1,1,TRUE,FALSE,FALSE,4,3,3,1,3,FALSE,FALSE,FALSE,Failed to climb to level two by slamming into Hab.,,28@CAVE:r[5700;3863;5477],0,3,3
5678,CAVE,29,b,TRUE,FALSE,TRUE,FALSE,FALSE,0,0,0,0,0,0,0,0,0,0,0,0,0,0,0,0,0,0,0,0,TRUE,FALSE,FALSE,1,1,1,1,1,FALSE,FALSE,FALSE,very big chungus robot; very slow; and got hatch panel stuck within chassis. looked confused/dazed.,,29@CAVE:b[5678;6934;6553],0,0,3
6553,CAVE,29,b,FALSE,TRUE,FALSE,TRUE,TRUE,0,0,0,0,0,0,0,0,0,0,0,0,0,0,0,0,0,0,1,0,TRUE,FALSE,FALSE,2,1,2,2,2,FALSE,FALSE,TRUE,Came close to tipping over a couple of times.,,29@CAVE:b[5678;6934;6553],2,1,3
6934,CAVE,29,b,FALSE,TRUE,TRUE,FALSE,TRUE,0,0,0,0,0,0,0,0,0,0,0,0,0,0,0,0,0,0,0,0,FALSE,FALSE,FALSE,2,1,3,2,5,FALSE,FALSE,TRUE,defended while holding a cargo. did not bother opponent very much,,29@CAVE:b[5678;6934;6553],1,0,0
294,CAVE,29,r,TRUE,FALSE,FALSE,TRUE,TRUE,0,0,0,0,0,0,0,0,0,0,2,0,0,2,1,0,0,1,3,0,FALSE,FALSE,TRUE,4,3,3,1,4,FALSE,FALSE,FALSE,Climbed with another robot to the third level; had defense on them,,29@CAVE:r[3512;294;3473],1,6,12
3473,CAVE,29,r,TRUE,FALSE,TRUE,FALSE,TRUE,0,0,0,0,0,0,0,0,0,1,2,0,0,2,1,0,0,1,3,1,TRUE,FALSE,FALSE,4,4,5,1,4,FALSE,FALSE,FALSE,Driving was super smooth. Wasn't too accurate when placing hatches on rocket,,29@CAVE:r[3512;294;3473],2,7,3
3512,CAVE,29,r,TRUE,FALSE,FALSE,TRUE,FALSE,0,0,0,0,1,0,0,1,0,0,0,0,0,0,0,0,0,0,0,0,FALSE,FALSE,TRUE,1,4,3,3,3,FALSE,FALSE,TRUE,Waited until end of sandstorm to immediately cross cargo ship line; not very irritating or effective. Pins followed rules. Climbed level three w other robots,,29@CAVE:r[3512;294;3473],0,0,12
3328,CAVE,30,b,TRUE,FALSE,TRUE,FALSE,TRUE,0,0,0,0,0,0,0,0,0,0,0,0,0,0,1,0,0,1,1,1,TRUE,FALSE,FALSE,2,2,1,1,2,FALSE,FALSE,FALSE,Has a very flimsy hatch mechanism had an extremely hard time grabbing up a hatch,,30@CAVE:b[7323;5869;3328],2,3,3
5869,CAVE,30,b,FALSE,FALSE,TRUE,FALSE,TRUE,0,0,0,0,0,0,0,0,0,0,0,0,0,0,0,1,1,2,0,0,TRUE,FALSE,FALSE,1,3,2,1,3,FALSE,FALSE,FALSE,swerve drive but still slow and had an inefficient intake,,30@CAVE:b[7323;5869;3328],1,2,3
7323,CAVE,30,b,TRUE,FALSE,TRUE,FALSE,TRUE,0,0,0,0,0,0,0,0,0,0,0,0,0,0,0,0,0,0,0,0,TRUE,FALSE,FALSE,1,1,3,2,2,FALSE,FALSE,TRUE,looked confused/lost,,30@CAVE:b[7323;5869;3328],0,0,3
115,CAVE,30,r,TRUE,FALSE,FALSE,TRUE,FALSE,0,0,0,0,0,0,0,0,0,1,0,0,0,0,0,0,0,0,6,0,TRUE,FALSE,FALSE,4,3,4,1,4,FALSE,FALSE,FALSE,,,30@CAVE:r[7650;115;3925],1,6,3
3925,CAVE,30,r,TRUE,FALSE,TRUE,FALSE,TRUE,0,0,0,0,1,0,0,1,0,0,0,2,0,2,0,2,1,3,0,0,TRUE,FALSE,FALSE,5,5,4,1,4,FALSE,FALSE,FALSE,Very quick at getting back to hab,,30@CAVE:r[7650;115;3925],2,5,3
7650,CAVE,30,r,TRUE,FALSE,TRUE,FALSE,TRUE,0,0,0,0,0,0,0,0,0,0,0,0,0,0,0,0,0,0,2,2,FALSE,TRUE,FALSE,4,3,3,1,2,FALSE,TRUE,FALSE,,,30@CAVE:r[7650;115;3925],0,4,6
4486,CAVE,31,b,FALSE,TRUE,TRUE,FALSE,FALSE,0,0,0,0,0,0,0,0,1,0,0,0,0,0,1,0,0,1,4,0,FALSE,TRUE,FALSE,5,3,3,1,4,FALSE,FALSE,FALSE,good cargo,,31@CAVE:b[5477;4486;599],1,5,6
5477,CAVE,31,b,FALSE,TRUE,TRUE,FALSE,TRUE,0,0,0,0,0,0,0,0,0,0,0,0,0,0,0,0,0,0,0,0,TRUE,FALSE,FALSE,1,1,3,1,2,FALSE,TRUE,FALSE,was kind of sad,,31@CAVE:b[5477;4486;599],0,0,3
599,CAVE,31,b,TRUE,FALSE,FALSE,TRUE,TRUE,0,0,0,0,0,0,0,0,0,0,0,0,0,0,2,0,0,2,2,1,TRUE,FALSE,FALSE,3,3,2,1,3,FALSE,FALSE,FALSE,Placed hatches and cargo pretty well on the bottom layer,,31@CAVE:b[5477;4486;599],2,5,3
2486,CAVE,31,r,FALSE,TRUE,FALSE,TRUE,TRUE,0,0,0,0,0,0,0,0,1,0,2,0,0,2,0,2,0,2,3,0,FALSE,FALSE,TRUE,5,4,4,1,4,FALSE,FALSE,FALSE,Very efficient,,31@CAVE:r[580;5137;2486],2,7,12
5137,CAVE,31,r,TRUE,FALSE,TRUE,FALSE,TRUE,0,0,0,0,0,0,0,0,0,0,0,0,0,0,2,0,0,2,0,0,FALSE,TRUE,FALSE,1,3,3,1,3,FALSE,FALSE,FALSE,They kept dropping the hatch when placing it,,31@CAVE:r[580;5137;2486],1,2,6
580,CAVE,31,r,TRUE,FALSE,FALSE,TRUE,TRUE,0,1,0,1,0,0,0,0,0,0,0,0,0,0,0,0,0,0,0,0,FALSE,FALSE,FALSE,1,1,1,1,1,FALSE,FALSE,FALSE,Lost connection,,31@CAVE:r[580;5137;2486],0,0,0
4201,CAVE,32,b,TRUE,FALSE,FALSE,TRUE,TRUE,0,0,0,0,1,0,0,1,0,0,0,0,0,0,1,2,1,4,3,0,TRUE,FALSE,FALSE,4,5,4,1,4,FALSE,FALSE,FALSE,,,32@CAVE:b[4201;5107;5700],0,7,3
5107,CAVE,32,b,FALSE,FALSE,FALSE,FALSE,FALSE,0,0,0,0,0,0,0,0,0,0,0,0,0,0,0,0,0,0,0,0,TRUE,FALSE,FALSE,1,1,1,1,1,FALSE,TRUE,TRUE,not good at defense just chasing the other robots but unable to stop them. no penalties but no pins either. didn't play defense just following robots in circles . defending a disabled robot. running into teammate's robots.,,32@CAVE:b[4201;5107;5700],1,0,3
5700,CAVE,32,b,TRUE,FALSE,FALSE,TRUE,TRUE,0,0,0,0,0,0,0,0,0,1,0,0,0,0,0,0,0,0,1,1,TRUE,FALSE,FALSE,2,2,2,1,3,FALSE,FALSE,FALSE,Very similar design as our robot but the accuracy and driving are of much lower quality than ours,,32@CAVE:b[4201;5107;5700],2,2,3
3863,CAVE,32,r,TRUE,FALSE,FALSE,TRUE,FALSE,0,0,0,0,0,0,0,0,0,0,0,0,0,0,0,0,0,0,0,0,FALSE,FALSE,FALSE,1,1,1,1,1,FALSE,FALSE,FALSE,,,32@CAVE:r[2199;6560;3863],2,0,0
6560,CAVE,32,r,FALSE,FALSE,FALSE,TRUE,TRUE,0,0,0,0,0,0,0,0,0,0,0,0,0,0,0,0,0,0,0,0,TRUE,FALSE,FALSE,1,1,3,2,4,TRUE,FALSE,TRUE,They didn't pin effec ti ve!y and rushed to robot into the hatch,,32@CAVE:r[2199;6560;3863],1,0,3
4711,CAVE,33,b,FALSE,TRUE,FALSE,FALSE,FALSE,0,0,0,0,0,0,0,0,0,0,0,0,0,0,0,0,0,0,1,0,FALSE,FALSE,FALSE,1,1,1,1,1,FALSE,FALSE,FALSE,dropped cargo in sandstorm after coming off of hab. very slow. keeps dropping cargo after picking it up. cycle time is super duper slow. driver is inexperienced,,33@CAVE:b[7324;4711;5510],1,1,0
5510,CAVE,33,b,TRUE,FALSE,FALSE,TRUE,TRUE,0,0,0,0,0,0,0,0,0,1,0,0,0,0,3,0,0,3,0,1,TRUE,FALSE,FALSE,1,3,2,1,2,FALSE,FALSE,FALSE,Is a ramp robot very slow and not very maneuverable i don't think it has a cargo mechanism,,33@CAVE:b[7324;4711;5510],2,4,3
7324,CAVE,33,b,FALSE,FALSE,TRUE,FALSE,FALSE,0,0,0,0,0,0,0,0,0,0,0,0,0,0,0,0,0,0,1,0,TRUE,FALSE,FALSE,3,1,3,1,3,FALSE,FALSE,FALSE,,,33@CAVE:b[7324;4711;5510],0,1,3
114,CAVE,33,r,TRUE,FALSE,TRUE,FALSE,TRUE,0,0,0,0,0,0,0,0,0,1,2,1,0,3,0,0,0,0,6,1,FALSE,FALSE,FALSE,4,3,4,1,4,FALSE,FALSE,FALSE,Cargo placement is really accurate and intake was accurate,,33@CAVE:r[7887;114;5857],1,10,0
5857,CAVE,33,r,TRUE,FALSE,FALSE,TRUE,FALSE,0,0,0,0,0,0,0,0,0,0,0,1,0,1,2,2,0,4,0,0,FALSE,FALSE,FALSE,3,4,4,1,4,FALSE,FALSE,FALSE,Very good at hatches,,33@CAVE:r[7887;114;5857],2,5,0
7887,CAVE,33,r,FALSE,FALSE,FALSE,TRUE,FALSE,0,0,0,0,0,0,0,0,0,0,0,0,0,0,0,0,0,0,0,0,TRUE,FALSE,FALSE,1,1,1,3,1,FALSE,FALSE,TRUE,Did a really good job at pinning but also wandered around aimlessly,,33@CAVE:r[7887;114;5857],0,0,3
1138,CAVE,34,b,TRUE,FALSE,FALSE,TRUE,TRUE,0,0,0,0,0,0,0,0,0,0,0,0,0,0,0,0,0,0,2,1,FALSE,TRUE,FALSE,3,1,2,1,3,FALSE,FALSE,FALSE,,,34@CAVE:b[7327;4414;1138],2,3,6
4414,CAVE,34,b,TRUE,FALSE,FALSE,FALSE,TRUE,0,0,0,0,0,0,1,1,0,0,2,2,2,6,2,2,1,5,0,0,FALSE,FALSE,TRUE,5,5,5,1,5,FALSE,FALSE,FALSE,amazing its high tide,,34@CAVE:b[7327;4414;1138],1,11,12
7327,CAVE,34,b,FALSE,TRUE,FALSE,TRUE,FALSE,0,0,0,0,0,0,0,0,0,0,0,0,0,0,0,0,0,0,3,0,FALSE,FALSE,FALSE,4,1,3,1,3,FALSE,FALSE,FALSE,their robot started stalling and the drivers were having trouble controlling the robot towards the end,,34@CAVE:b[7327;4414;1138],0,3,0
2543,CAVE,34,r,TRUE,FALSE,FALSE,TRUE,TRUE,0,0,0,0,0,0,0,0,0,1,0,0,0,0,0,0,0,0,4,0,FALSE,FALSE,TRUE,4,1,3,1,5,FALSE,TRUE,FALSE,Bumped into alliance team once. Can level 3 climb pretty fast.Intake for cargo is efficient.,,34@CAVE:r[5102;5818;2543],2,4,12
5102,CAVE,34,r,TRUE,FALSE,TRUE,FALSE,TRUE,0,0,0,0,0,0,0,0,0,0,0,0,0,0,0,0,0,0,0,0,FALSE,FALSE,FALSE,1,2,2,1,1,FALSE,FALSE,FALSE,Driving was slow and bad and weren't able to even take ground intaks,,34@CAVE:r[5102;5818;2543],0,0,0
5818,CAVE,34,r,TRUE,FALSE,FALSE,TRUE,TRUE,0,0,0,0,0,0,0,0,0,2,2,0,0,2,4,0,0,4,0,0,TRUE,FALSE,FALSE,4,5,4,1,4,FALSE,FALSE,FALSE,Went for hatches first and then cargo. Can't go for high level cargo or hat changes,,34@CAVE:r[5102;5818;2543],1,6,3
4470,CAVE,35,b,FALSE,FALSE,TRUE,FALSE,TRUE,0,0,0,0,0,0,0,0,0,0,0,0,0,0,0,0,0,0,1,0,TRUE,FALSE,FALSE,1,1,1,1,2,FALSE,FALSE,FALSE,Just kind of drove around in circles not really trying to pick up or score anything,,35@CAVE:b[6398;5136;4470],2,1,3
5136,CAVE,35,b,TRUE,FALSE,FALSE,TRUE,TRUE,0,0,0,0,0,0,0,0,0,1,0,0,0,0,2,0,0,2,1,0,FALSE,TRUE,FALSE,3,2,1,1,2,FALSE,FALSE,FALSE,,,35@CAVE:b[6398;5136;4470],1,3,6
6398,CAVE,35,b,TRUE,FALSE,FALSE,TRUE,TRUE,0,0,0,0,0,0,0,0,0,0,0,0,0,0,0,0,0,0,3,0,TRUE,FALSE,FALSE,4,1,4,3,2,FALSE,FALSE,TRUE,their defense was all over the place and their main strategy was just to run into other robots to prevent them from scoring.,,35@CAVE:b[6398;5136;4470],0,3,3
3303,CAVE,35,r,TRUE,FALSE,TRUE,FALSE,FALSE,0,0,0,0,0,0,0,0,0,0,0,0,0,0,0,0,0,0,5,0,FALSE,FALSE,FALSE,4,1,3,1,3,FALSE,FALSE,FALSE,Dropped hatch a the beginning of the game,,35@CAVE:r[7326;6764;3303],2,5,0
6764,CAVE,35,r,FALSE,FALSE,TRUE,FALSE,FALSE,0,0,0,0,0,0,0,0,0,0,0,0,0,0,0,0,0,0,0,0,FALSE,FALSE,FALSE,1,1,3,1,3,FALSE,FALSE,FALSE,Slow reaction timeWandered aimlesslySketch elevatorJerky movementsDidn't do anything,,35@CAVE:r[7326;6764;3303],1,0,0
7326,CAVE,35,r,FALSE,FALSE,FALSE,TRUE,FALSE,0,0,0,0,0,0,0,0,0,0,0,0,0,0,0,0,0,0,0,0,FALSE,FALSE,FALSE,1,1,1,2,1,FALSE,FALSE,TRUE,Tried to play defense but failed;they just drove around rigid and shaky,,35@CAVE:r[7326;6764;3303],0,0,0
114,CAVE,36,b,TRUE,FALSE,TRUE,FALSE,TRUE,0,0,0,0,1,0,0,1,1,0,0,0,0,0,0,2,2,4,3,0,TRUE,FALSE,FALSE,4,4,4,1,4,FALSE,FALSE,FALSE,114 committed a 2 ball foul during the sandstorm,,36@CAVE:b[114;7324;5137],0,7,3
5137,CAVE,36,b,TRUE,FALSE,FALSE,TRUE,TRUE,0,0,0,0,0,0,0,0,0,0,0,0,0,0,0,0,0,0,2,0,FALSE,TRUE,FALSE,3,2,3,1,2,FALSE,FALSE,FALSE,Missed all hatch panel placements; and climbed efficiently with a did under supporting the back half,,36@CAVE:b[114;7324;5137],2,2,6
7324,CAVE,36,b,TRUE,FALSE,TRUE,FALSE,TRUE,0,0,0,0,0,0,0,0,0,0,0,0,0,0,0,0,0,0,0,0,TRUE,FALSE,FALSE,1,1,1,1,1,FALSE,FALSE,FALSE,,,36@CAVE:b[114;7324;5137],1,0,3
3473,CAVE,36,r,TRUE,FALSE,FALSE,TRUE,TRUE,0,0,0,0,0,0,0,0,0,1,0,0,0,0,0,0,0,0,5,0,TRUE,FALSE,FALSE,5,3,3,1,4,FALSE,FALSE,FALSE,Great cargo intake and accurate. Fast cargo cycle.,,36@CAVE:r[5700;5869;3473],2,5,3
5700,CAVE,36,r,FALSE,FALSE,FALSE,FALSE,FALSE,0,0,0,0,0,0,0,0,0,0,0,0,0,0,2,0,0,2,0,2,TRUE,FALSE,FALSE,1,3,3,1,2,FALSE,FALSE,FALSE,Really slow hatch cycle times; missed it many times,,36@CAVE:r[5700;5869;3473],0,4,3
5869,CAVE,36,r,FALSE,FALSE,TRUE,FALSE,FALSE,0,0,0,0,0,0,0,0,0,0,0,0,0,0,0,0,0,0,0,0,TRUE,FALSE,FALSE,1,1,4,3,4,FALSE,FALSE,TRUE,Not aggressiveRams sides not cornersAttwmlss to block rather than hitNot very effective defenseCame back at 30 seconds,,36@CAVE:r[5700;5869;3473],1,0,3
115,CAVE,37,b,TRUE,FALSE,FALSE,TRUE,TRUE,0,0,0,0,0,0,0,0,0,1,1,0,0,1,2,0,0,2,3,0,FALSE,TRUE,FALSE,5,5,5,1,5,FALSE,FALSE,FALSE,Quite a saucy robot,,37@CAVE:b[7327;4486;115],2,6,6
4486,CAVE,37,b,FALSE,TRUE,FALSE,TRUE,TRUE,0,0,0,0,0,0,0,0,1,0,0,0,0,0,2,2,0,4,0,0,FALSE,TRUE,FALSE,3,2,1,1,1,FALSE,FALSE,FALSE,,,37@CAVE:b[7327;4486;115],1,4,6
7327,CAVE,37,b,FALSE,TRUE,TRUE,FALSE,TRUE,1,0,0,1,0,0,0,0,0,0,0,0,0,0,1,0,0,1,3,1,TRUE,FALSE,FALSE,4,3,3,1,3,FALSE,FALSE,FALSE,,,37@CAVE:b[7327;4486;115],0,5,3
5107,CAVE,37,r,TRUE,FALSE,FALSE,TRUE,TRUE,0,0,0,0,0,0,0,0,0,0,0,0,0,0,1,1,0,2,0,0,FALSE,FALSE,FALSE,1,2,1,1,1,FALSE,FALSE,FALSE,Hatch panel was disgusting; they took forever to get ground intake and couldn't place it either,,37@CAVE:r[5107;5477;6934],0,2,0
5477,CAVE,37,r,FALSE,TRUE,FALSE,TRUE,TRUE,0,0,0,0,0,0,0,0,0,0,0,0,0,0,1,0,0,1,1,0,TRUE,FALSE,FALSE,4,3,3,1,4,FALSE,FALSE,FALSE,It has slow cycle timesSketch climbIntake and output took a long time,,37@CAVE:r[5107;5477;6934],1,2,3
6934,CAVE,37,r,FALSE,TRUE,TRUE,FALSE,TRUE,0,0,0,0,0,0,0,0,0,0,0,0,0,0,0,0,0,0,1,0,TRUE,FALSE,FALSE,3,1,3,3,3,FALSE,FALSE,TRUE,Defense is ok. 50% success rate for defense. Went back just in time for ckimb.,,37@CAVE:r[5107;5477;6934],2,1,3
2543,CAVE,38,b,TRUE,FALSE,FALSE,TRUE,TRUE,0,0,0,0,0,0,0,0,0,0,2,0,0,2,0,0,0,0,4,1,FALSE,FALSE,TRUE,2,3,4,1,3,FALSE,FALSE,FALSE,Moved the disabled bot; picked up a lot of cargo and hatches; and wasted little time,,38@CAVE:b[4201;6764;2543],2,7,12
4201,CAVE,38,b,TRUE,FALSE,FALSE,TRUE,TRUE,0,0,0,0,1,0,0,1,0,0,1,0,0,1,1,2,2,5,0,0,TRUE,FALSE,FALSE,4,4,4,1,4,FALSE,FALSE,FALSE,cycle time was fast; able to do all three levels for cargo and hatches,,38@CAVE:b[4201;6764;2543],0,6,3
6764,CAVE,38,b,FALSE,FALSE,TRUE,FALSE,FALSE,0,0,0,0,0,0,0,0,0,0,0,0,0,0,0,0,0,0,0,0,FALSE,FALSE,FALSE,1,1,1,1,1,FALSE,FALSE,FALSE,not disabled but issues with drive train and did not move throughout the match scored nothing,,38@CAVE:b[4201;6764;2543],1,0,0
4711,CAVE,38,r,FALSE,TRUE,FALSE,TRUE,FALSE,0,0,0,0,0,0,0,0,0,0,0,0,0,0,0,0,0,0,0,0,TRUE,FALSE,FALSE,1,1,2,1,1,FALSE,FALSE,FALSE,Arm was big and useless; kinda too complex and they couldn't control it properly and drive properly,,38@CAVE:r[4711;7323;580],0,0,3
580,CAVE,38,r,TRUE,FALSE,FALSE,TRUE,TRUE,0,0,0,0,1,0,0,1,0,0,0,0,0,0,2,0,0,2,0,3,TRUE,FALSE,FALSE,1,5,4,1,5,FALSE,FALSE,FALSE,Climbed onto hab very quickly in the last few seconds,,38@CAVE:r[4711;7323;580],2,5,3
7323,CAVE,38,r,TRUE,FALSE,TRUE,FALSE,FALSE,0,0,0,0,0,0,0,0,0,0,0,0,0,0,0,0,0,0,0,0,TRUE,FALSE,FALSE,1,1,3,1,2,FALSE,FALSE,FALSE,Did nothing just drive aimlesslyDropped hatch panelCrossed cargo line but didn't play defense just went back and forth between2 sides,,38@CAVE:r[4711;7323;580],1,0,3
3863,CAVE,39,b,TRUE,FALSE,TRUE,FALSE,FALSE,0,0,0,0,1,0,0,1,0,0,2,2,1,5,1,2,2,5,0,0,FALSE,FALSE,FALSE,5,5,4,1,4,FALSE,FALSE,FALSE,Almost finished a whole rocket by themselves missed two cargo in the last seconds,,39@CAVE:b[6553;5510;3863],2,10,0
5510,CAVE,39,b,TRUE,FALSE,FALSE,TRUE,TRUE,0,0,0,0,0,0,0,0,0,0,0,0,0,0,0,0,0,0,0,1,TRUE,FALSE,FALSE,1,3,2,1,4,FALSE,FALSE,FALSE,ramp bot bad intake only hatch lv1 ramp attempted not successful,,39@CAVE:b[6553;5510;3863],1,1,3
6553,CAVE,39,b,FALSE,TRUE,FALSE,TRUE,TRUE,0,0,0,0,0,0,0,0,0,0,0,0,0,0,0,0,0,0,3,0,TRUE,FALSE,FALSE,4,1,3,1,4,FALSE,FALSE,FALSE,had a difficult time grabbing on to the cargo.,,39@CAVE:b[6553;5510;3863],0,3,3
4414,CAVE,39,r,TRUE,FALSE,FALSE,TRUE,TRUE,0,0,0,0,0,0,1,1,0,0,2,2,2,6,2,2,1,5,0,0,FALSE,FALSE,TRUE,5,5,5,2,5,FALSE,FALSE,TRUE,,,39@CAVE:r[4414;599;5136],0,11,12
5136,CAVE,39,r,TRUE,FALSE,FALSE,TRUE,TRUE,0,0,0,0,0,0,0,0,0,1,0,0,0,0,2,0,0,2,2,0,TRUE,FALSE,FALSE,4,2,2,1,2,FALSE,FALSE,FALSE,Hatching mechanism is kinda jank,,39@CAVE:r[4414;599;5136],2,4,3
